{
  "action_id": "AVX-ACT-c3d4e5f6-a7b8-9012-cdef-123456789012",
  "finding_id": "FIND-a1b2c3d4-e5f6-7890-abcd-ef1234567890",
  "created_by": "owner-usr-4a5b6c7d",
  "created_at": "2026-09-18T10:15:00Z",
  "updated_at": "2026-09-18T10:15:00Z",
  "target_system": "dms",
  "target_ref": "DMS-RO-20261001-0042",
  "status": "executed",
  "action_kind": "book_combined_visit",
  "parameters": {
    "preferred_date": "2026-10-01",
    "preferred_time_window": "09:00-12:00",
    "dealership_id": "dlr-west-coast-001",
    "services_requested": [
      "tire_inspection",
      "rotation"
    ]
  },
  "evidence": [
    {
      "kind": "adp.tires.prediction",
      "source": "adp-staging",
      "source_ref": "athena-query-K7QIFGDP27",
      "value": {
        "vin": "1HGBH41JXMN109186",
        "position": "front_left",
        "current_pressure_psi": 28.1,
        "threshold_psi": 34.0,
        "deviation_pct": -17.35,
        "trend": "slow_leak",
        "days_to_threshold": 8
      },
      "computed_at": "2026-09-18T02:00:00Z",
      "provenance": "live"
    }
  ],
  "audit_trail": [
    {
      "at": "2026-09-18T10:15:00Z",
      "by": "owner-usr-4a5b6c7d",
      "from_status": "pending_execution",
      "to_status": "executed",
      "note": "Owner approved via iOS card 'Book Visit' CTA"
    }
  ]
}
